{
  "chapter": 11,
  "title": "Implementations",
  "fls_url": "https://rust-lang.github.io/fls/implementations.html",
  "fls_id": "fls_fk2m2irwpeof",
  "repository": "eclipse-iceoryx/iceoryx2",
  "version": "0.8.0",
  "analysis_date": "2025-12-30",
  "version_changes": {
    "from_version": "0.7.0",
    "to_version": "0.8.0",
    "summary": "Major growth in implementations due to expanded codebase and FFI layer. Total impl blocks increased 77% (1353->2397), unsafe impl increased 232% (66->219) due to FFI types requiring Send/Sync.",
    "key_changes": [
      "Directory structure changed: iceoryx2-bb-*-0.7.0/ -> iceoryx2-bb/*/",
      "Total impl blocks increased from 1353 to 2397 (+77%)",
      "Trait implementations increased from 1163 to 956 (restructured counting)",
      "unsafe impl increased from 66 to 219 (+232%) for FFI type safety",
      "Generic implementations increased from 197 to 571 (+190%)",
      "Self keyword usage throughout implementations"
    ]
  },
  "summary": "FLS Chapter 11 defines implementations as items that supplement an implementing type by extending its functionality. There are two kinds: inherent implementations (adding direct functionality) and trait implementations (adding functionality specified by a trait). iceoryx2 v0.8.0 uses 2,397 impl blocks total, with heavy use of trait implementations for abstraction and unsafe impl for Send/Sync markers on IPC and FFI types.",
  "statistics": {
    "total_impl_blocks": 2397,
    "inherent_impl_blocks": 1336,
    "trait_implementations": 956,
    "generic_implementations": 333,
    "unsafe_impl_blocks": 66,
    "trait_definitions": 124
  },
  "sections": {
    "implementation_coherence": {
      "fls_section": "11.1",
      "fls_ids": [
        "fls_46ork6fz5o2e"
      ],
      "description": "Implementation Coherence",
      "status": "demonstrated",
      "findings": {
        "patterns": [
          "Orphan rule compliance",
          "Platform-specific implementations via cfg",
          "Generic implementations with distinct bounds"
        ],
        "coherence_strategies": {
          "local_trait_for_local_type": true,
          "foreign_trait_for_local_type": true
        }
      },
      "samples": [
        {
          "file": "iceoryx2-bb/testing/src/lifetime_tracker.rs",
          "line": [
            50
          ],
          "code": "unsafe impl ZeroCopySend for LifetimeTracker {}",
          "purpose": "Local trait for local type (coherent)"
        },
        {
          "file": "iceoryx2-bb/posix/src/socket_ancillary.rs",
          "line": [
            167
          ],
          "code": "impl Display for SocketCred { ... }",
          "purpose": "Foreign trait (Display) for local type"
        },
        {
          "file": "iceoryx2/src/service/attribute.rs",
          "line": [398, 399, 400, 401, 402, 403],
          "code": "impl Deref for AttributeSet {\n    type Target = [Attribute];\n\n    fn deref(&self) -> &Self::Target {\n        self.0.as_slice()\n    }\n}",
          "purpose": "Foreign trait (Deref) for local type enabling slice access to attributes"
        }
      ],
      "count": 948
    },
    "implementation_conformance": {
      "fls_section": "11.2",
      "fls_ids": [
        "fls_e1pgdlv81vul"
      ],
      "description": "Implementation Conformance",
      "status": "demonstrated",
      "findings": {
        "patterns": [
          "All required trait methods implemented",
          "All associated types bound",
          "Default implementations used"
        ],
        "common_conformance": {
          "Default": 55,
          "Drop": 41,
          "From": 143,
          "Deref": 4
        }
      },
      "samples": [
        {
          "file": "iceoryx2-bb/posix/src/mutex.rs",
          "line": [
            190,
            191,
            192
          ],
          "code": "impl<T: Debug> Deref for MutexGuard { type Target = T; fn deref(&self) -> &Self::Target { ... } }",
          "purpose": "Complete Deref conformance with associated type"
        },
        {
          "file": "iceoryx2-bb/posix/src/barrier.rs",
          "line": [
            162,
            163
          ],
          "code": "unsafe impl Send for BarrierHandle {}\nunsafe impl Sync for BarrierHandle {}",
          "purpose": "Marker trait implementations for thread safety"
        },
        {
          "file": "iceoryx2-bb/elementary-traits/src/zero_copy_send.rs",
          "line": [50, 51, 52, 53],
          "code": "unsafe impl ZeroCopySend for usize {}\nunsafe impl ZeroCopySend for u8 {}\nunsafe impl ZeroCopySend for u16 {}\nunsafe impl ZeroCopySend for u32 {}",
          "purpose": "Unsafe marker trait implementations for primitive types enabling zero-copy IPC"
        }
      ],
      "count": 2050
    }
  },
  "cross_chapter_references": {
    "chapter_3": "Implementations are items",
    "chapter_4": "Implementing types are types; trait implementations implement traits",
    "chapter_10": "Associated items within implementations",
    "chapter_12": "Generic parameters and where clauses on implementations",
    "chapter_17": "Send/Sync implementations for concurrency safety",
    "chapter_19": "Unsafe trait implementations"
  }
}